{
  "$schema": "http://json-schema.org/draft-07/schema#",
  "title": "Cortex Event Schema",
  "description": "Schema for all events in the Cortex event-driven architecture",
  "type": "object",
  "required": ["event_id", "event_type", "timestamp", "source"],
  "properties": {
    "event_id": {
      "type": "string",
      "pattern": "^evt_[0-9]{8}_[0-9]{6}_[a-z0-9]+$",
      "description": "Unique event identifier (format: evt_YYYYMMDD_HHMMSS_random)"
    },
    "event_type": {
      "type": "string",
      "enum": [
        "worker.started",
        "worker.completed",
        "worker.failed",
        "worker.heartbeat",
        "task.created",
        "task.assigned",
        "task.completed",
        "task.failed",
        "security.scan_completed",
        "security.vulnerability_found",
        "routing.decision_made",
        "learning.pattern_detected",
        "learning.model_updated",
        "system.cleanup_needed",
        "system.health_alert",
        "daemon.started",
        "daemon.stopped"
      ],
      "description": "Type of event"
    },
    "timestamp": {
      "type": "string",
      "format": "date-time",
      "description": "ISO 8601 timestamp with timezone"
    },
    "source": {
      "type": "string",
      "description": "Source component that emitted the event"
    },
    "correlation_id": {
      "type": "string",
      "description": "ID to correlate related events (e.g., task ID, worker ID)"
    },
    "metadata": {
      "type": "object",
      "properties": {
        "master": {
          "type": "string",
          "description": "Associated master component"
        },
        "priority": {
          "type": "string",
          "enum": ["low", "medium", "high", "critical"]
        },
        "tags": {
          "type": "array",
          "items": {"type": "string"}
        }
      }
    },
    "payload": {
      "type": "object",
      "description": "Event-specific data payload"
    }
  }
}
