{
  "event_id": "evt_20251201_124046_00336861d6f1",
  "event_type": "learning.pattern_detected",
  "timestamp": "2025-12-01T18:40:46+0000",
  "source": "on-worker-complete-handler",
  "correlation_id": "task-test-001",
  "metadata": {
    "priority": "medium"
  },
  "payload": {
    "worker_id": "worker-test-001",
    "task_id": "task-test-001",
    "tokens_used": 100,
    "duration_ms": 5000,
    "outcome": "success"
  }
}
